tweet_id,user_id,created_at,text,url,mentions,lang,favorites,retweets,replies,quotes,view_count,hashtags
1727797789814386988,1319724600629071874,Thu Nov 23 21:14:28 +0000 2023,OdumoduBlvck and Black Sherif on set for music video in London    From city  Samklef  chef Dammy  Mr ibu  olamide oladips  smada  baddo  Lojay  piggyvest  the time is now,https://t.co/zm6TnqUqhM,,en,3,1,0,0,1568,
1727791638703985006,1147981875656503296,Thu Nov 23 20:50:02 +0000 2023,2Hrs AWAY TO END 1 SESSION OF STREAK DON'T PANIC JUST FARM ON  COMMENT LIKE RETWEET QUOTE RETWEET SIWES ChefDammy Smada ShaffyBello Shola Olamide Cuppy Piggyvest ApostleAromeOsayi Pocolee,https://t.co/GiIjMR8m5M,,en,5,13,14,13,1689,SIWES ChefDammy Smada ShaffyBello Shola Olamide Cuppy Piggyvest ApostleAromeOsayi Pocolee
1727808227822240166,58200301,Thu Nov 23 21:55:57 +0000 2023,"This is lovely, fashion reconfigured.  Mr Ibu Obi Cubana Peter Obi Lauren James PiggyVest Qudus Nigeria Air Chef Dammy Ogunmepon Farm City Efulefu Apostle Arome PDAPC Assaulted Egungun Racism Ada Anambra Owerri Hatrick Rotimi Shaffy Bello Disasi",https://t.co/vq17rsWRR2,,en,27,17,10,1,14732,
1727783697233965359,1234582765707894784,Thu Nov 23 20:18:28 +0000 2023,The Piggyvest you people are rooting for has refused to open since morning o. Shey this is what were using to start,https://t.co/eyVnU6HvK3,,en,13,0,11,2,11296,
1727800484696580420,58200301,Thu Nov 23 21:25:11 +0000 2023,"Watch to the end, this is heartbreaking  sorry guy. Mr Ibu Obi Cubana Peter Obi Lauren James PiggyVest Qudus Nigeria Air Chef Dammy Ogunmepon Farm City Efulefu Apostle Arome PDAPC Assaulted Egungun Racism",https://t.co/nqAHkpiCJ0,,en,21,20,4,0,11992,
1727793152617074973,1147981875656503296,Thu Nov 23 20:56:03 +0000 2023,DON'T FADE STREAK BRO DO THE NEEDFUL MY GEE COMMENT LIKE RETWEET QUOTE RETWEET SIWES ChefDammy Smada ShaffyBello Shola Olamide Cuppy Piggyvest ApostleAromeOsayi Pocolee,https://t.co/RVB9sQ7QZb,,en,12,16,23,15,4033,SIWES ChefDammy Smada ShaffyBello Shola Olamide Cuppy Piggyvest ApostleAromeOsayi Pocolee
1727779180777992541,926734266431623168,Thu Nov 23 20:00:31 +0000 2023,"I dont just sell Perfumes, I also give you recommendations based on your needs and budget. Dm or call 08069830203 Abuja, Wuse 2  08069830203 Nationwide delivery   Mr Ibu Chef Dammy Godwin Emefiele SIWES PiggyVest ",https://t.co/HZOeNi657R,,en,53,47,1,0,16104,
1728007993269141560,1139617385873334274,Fri Nov 24 11:09:45 +0000 2023,One book is N2000  Why cant we break our piggyvest safe lock,,,en,2,1,2,0,824,
1728141229857136701,385986859,Fri Nov 24 19:59:11 +0000 2023,"Ladies, open your Piggyvest and come buy something nice for your man this season ",,,en,10,5,2,0,4216,
1728483682829193649,943178014057263104,Sat Nov 25 18:39:58 +0000 2023,"idk if its piggyvest or zenith, but one of them is definitely trying me",,,en,3,0,2,0,433,
1725519285533962569,1474151162601426949,Fri Nov 17 14:20:30 +0000 2023,person wey see my piggyvest dey see me dey save money go think say i dey save for my future. Them nor know say na december balling money i dey try gather.,https://t.co/HxWkLjlEL5,,en,15,1,2,0,1130,
1726255487312970103,1342074586272292864,Sun Nov 19 15:05:55 +0000 2023,"You and babe dey collect allowance, you dey use your own soft am. Her own dey chill for PiggyVest ",,,en,35,9,3,0,3136,
1727080775789797757,949787703452798976,Tue Nov 21 21:45:19 +0000 2023,Wait. You people actually really have money in your PiggyVest Ah,,,en,3,2,3,0,1552,
1727805157256151159,1234582765707894784,Thu Nov 23 21:43:45 +0000 2023,"Now that were here, Piggyvest, let there not be any reason for chest pain. Dont trend unnecessarily o. Your company will not burn. Thanks. ",,,en,132,8,10,0,8375,
1727811200036036633,1021693345,Thu Nov 23 22:07:45 +0000 2023,PiggyVest is trending I remember my 2k,https://t.co/E0DuMTY64R,,en,2,0,1,0,939,
1727610285249155495,776580481,Thu Nov 23 08:49:24 +0000 2023,Piggyvest Chicken Republic cookieschocolate People's Hoodies amp Tshirts Hair bonnetnet Wigs Hand bags Skincare Flo app Instagram Shoes Sharwama amp Pizza Other people's sneakers KDrama MeatChicken Big Brother Naija Fruits Other people's face cap Man  Other people's money. ,,,en,3,0,1,0,354,
1727807795502649472,1178751449507024900,Thu Nov 23 21:54:14 +0000 2023,Safelock on piggyvest no go even shake body,,,en,1,0,0,0,372,
1724393318568604149,215043698,Tue Nov 14 11:46:19 +0000 2023,Market women for ceiling challenge The NLC University of Ibadan NLC President Pastor Tobi Asap Rocky Naomi Campbell Emilokan Eleganza SAED Piggyvest Strike Naira,https://t.co/creCyJ2uey,,en,32,2,4,0,7548,
1724407657858035847,1059117160591736833,Tue Nov 14 12:43:18 +0000 2023,Did TACHA just call Odumodublvck and Blaqbonze up coming Artiste  Strike Thats 320k Naira Rema PiggyVest XiJinping University of Ibadan Uriel Spaghetti Tinubu AFCON Jadon Sancho Werner Nuhu Nkunku Will Smith Ribadu Super Eagles ASUU CODE 28 UNLOCKED NLC President DavidoOnSet US Dollars VENITA THE COVER GIRL Gigi,,,en,107,24,27,9,75522,XiJinping DavidoOnSet
1724404102732325353,1641881382757466114,Tue Nov 14 12:29:10 +0000 2023,I follow baçk The NLC Piggyvest Naira Naomi Campbell Jadon Sancho Nuhu Ribadu Ramsdale Tribalism Hamas Xi Jin Ping.China Israel Biden.Breaking News. California.Tinubu. Rema..call Indonesia.Chelsea.Plamer.Illegal.Secret Anne Raya.Endrick. Visa. Asap Rocky Asake. Samsung,,,en,31,17,10,0,6252,
1724412499557015832,1129689823890026496,Tue Nov 14 13:02:32 +0000 2023,Pause and listen to this profound teaching by Pastor David Ogbueli on dealing with infertility.  Part 2  Emilokan NLC President Pastor Tobi Piggyvest Osimhen Air Peace Nuhu Ribadu Tinubu Asake The NLC University of Ibadan Spaghetti Imo State Tribalism Igbo Eleganza,https://t.co/rqINLxEv8V,,en,7,4,1,0,1186,
1724408833517166958,1357768344586375169,Tue Nov 14 12:47:58 +0000 2023,Handler dey active Strike Thats 320k Spaghetti PiggyVest,https://t.co/d7g2CzqSQb,,en,8,2,0,0,4260,
1724388774694584616,1300898917341704197,Tue Nov 14 11:28:16 +0000 2023,Today way I say my show my skills infront of my Crush   Spaghetti Tinubu omo igbo juve Abuja piggyvest dest reman merlin super eagles congratulationss tribalism laptop Werner nuhu ribadu,https://t.co/tJh8qXMQtx,,en,42,13,11,1,13532,
1724421085494481358,920641327,Tue Nov 14 13:36:39 +0000 2023,Fire is not your mate bro  . . . Strike Thats 320k Naira Rema PiggyVest XiJinping University of Ibadan Uriel Spaghetti Tinubu AFCON Jadon Sancho Werner Nuhu Nkunku Will Smith Ribadu Super Eagles ASUU CODE 28 UNLOCKED NLC President DavidoOnSet US Dollars VENITA THE COVER GIRL Gigi,,,en,19,0,14,1,2736,XiJinping DavidoOnSet
1724399988669665426,215043698,Tue Nov 14 12:12:49 +0000 2023,Commentary Signature The NLC University of Ibadan NLC President Pastor Tobi Asap Rocky Naomi Campbell Emilokan Eleganza SAED Piggyvest Strike Naira,https://t.co/c6k2DnxUUC,,en,5,1,1,0,1515,
1724407990789316656,215043698,Tue Nov 14 12:44:37 +0000 2023,Watch Actress Lizzy Anjorin Dance Like Never Before Strike That's 320k Piggyvest Pastor Tobi Will Smith University of Ibadan Spaghetti Nuhu Ribadu Eleganza SAED Emilokan LASTMA,https://t.co/0nwFjNZyVn,,en,6,0,0,0,1824,
1724403131008635080,215043698,Tue Nov 14 12:25:18 +0000 2023,how would you feel seeing dis in your nightmare NLC President Nuhu Ribadu Eleganza  University of Ibadan Air Peace  Tribalism  Tinubu Naomi Campbell  Nigeria Gbadebo Mr Bayo  Pastor Tobi Bashir  EmilokanStrikeNairaPiggyvest,https://t.co/ypyBvUBtIu,,en,8,0,0,0,1788,
1724406704387891209,215043698,Tue Nov 14 12:39:30 +0000 2023,Actress Lizzy Anjorins Distributes Food Worth 20 Million Naira at Her Yeye Bobaselu Installation Strike That's 320k Piggyvest Pastor Tobi Will Smith University of Ibadan Spaghetti Nuhu Ribadu Eleganza SAED,https://t.co/2jyB1JvA62,,en,6,1,0,0,2974,
1724395453939147023,215043698,Tue Nov 14 11:54:48 +0000 2023,Ooni of Ife's First Wife Wins Hearts with Kind Gesture at InLaw's Wedding The NLC University of Ibadan NLC President Pastor Tobi Asap Rocky Naomi Campbell Emilokan Eleganza SAED Piggyvest Strike Naira,https://t.co/6kLDYhOTdp,,en,3,0,0,0,1277,
1724410785072329105,215043698,Tue Nov 14 12:55:43 +0000 2023,How Lizzy Anjorin and Her Hubby Stole the Show with Their Grand Arrival at Her Coronation Strike That's 320k Piggyvest Pastor Tobi Will Smith University of Ibadan Spaghetti Nuhu Ribadu Eleganza SAED Emilokan LASTMA,https://t.co/ViDHw9M75z,,en,4,0,0,0,1430,
1724395974154391990,762923771091189760,Tue Nov 14 11:56:52 +0000 2023,85 hours to go 114 hours done The goal is in sight Ogbomosho stand up Oyo state stand up Nigeria stand up Chef Tope Maggie is coming ChefTopeMaggie Naira The NLC Tinubu Piggyvest Nuhu Ribadu Tribalism,https://t.co/SRB8y1MMe0,@GWR,en,14,3,0,0,1912,ChefTopeMaggie
1724711469088931887,1092349647094534144,Wed Nov 15 08:50:32 +0000 2023,Always check their piggyvest,,,en,2,1,0,0,252,
1724836021068521953,1572164504594644997,Wed Nov 15 17:05:27 +0000 2023,So una still dey use piggyvest for this countryI thought we are all brokewhere una dey see money save,,,en,26,6,7,2,2268,
1721852020536045755,1318524448576819200,Tue Nov 07 11:28:06 +0000 2023,Thank God I have money already in Piggyvest for asoebi this year Onion green and blackish red is the code,,,en,1,1,1,0,251,
1719443962354676064,1669902260158038018,Tue Oct 31 19:59:21 +0000 2023,The moment Armed men rubbed a South African church on Sunday service . Mr Ibu Sportybet is Broke Asisat Oshoala Ronaldo John Dumelo Mr Ibu Happie Boys Ifeanyi Piggyvest Aaron Donald Brymo Messi SLarry Asisat Oshoala Mutarisi Fubara Victor Osimhen,https://t.co/J997ceYSMx,,en,3,1,1,0,4287,
1719432524588343459,1325372539758063617,Tue Oct 31 19:13:54 +0000 2023,God will continue to fight for you Mr Ibu Sammy Larry Piggyvest Happie Boys Cyprus Nyesom Wike Sportybet is Broke ADEKUNLE THE CLOUT Brymo Asake Presidential Villa Yul Edochie React Native Wizkid Gachagua Patricia Rufai Oseni Dubai So Elon Rivers Hisbah Sultan Abati Burna Natasha,https://t.co/R5UnBvQoUx,,en,40,23,25,0,25984,
1719501665739374822,1534299497370726402,Tue Oct 31 23:48:38 +0000 2023,Forever you're the Goat   Halloween Morocco Chase Young Asake John Lynch Ifeanyi Saudi Arabia Dobbs Piggyvest Josh Hawley Mr Ibu Yemen Happie Boys Joe Rohan Seyi Tinubu Bolivia Madam Koi Koi Halle Rufai Oseni ,https://t.co/LECNQtXXhX,@Cristiano,en,6,2,4,0,950,
1719514694988214357,1704199948265230336,Wed Nov 01 00:40:24 +0000 2023,Dog self Dey get m  for head Currently following anybody that follows and retweet this post Halloween Morocco Chase Young Asake John Lynch Ifeanyi Saudi Arabia Dobbs Piggyvest Josh Hawley Mr Ibu Yemen Happie Boys Joe Rohan Seyi Tinubu Bolivia Madam Koi Koi Halle Rufai,https://t.co/qV2mKcLGuA,,en,5,3,0,0,1678,
1719440272688283660,1669902260158038018,Tue Oct 31 19:44:41 +0000 2023,Africans fear God o  Mr Ibu Sportybet is Broke Asisat Oshoala Ronaldo John Dumelo Sportybet is Broke Mr Ibu Happie Boys Ifeanyi Piggyvest Aaron Donald Brymo Messi SLarry Asisat Oshoala Mutarisi Fubara Victor Osimhen,https://t.co/uiLeQKi3fq,,en,5,3,0,0,7882,
1719455694682739020,1704513692308582400,Tue Oct 31 20:45:58 +0000 2023,No dey do pass yourself Mr Ibu Pete Edochie Ifeanyi Asisat Oshoala Happie Boys Patricia Layi Sportybet is Broke Saudi Arabia Wike Mainoo Israel Brymo Khloe Yul Edochie Natasha Morocco Moniepoint Piggyvest Olubunmi TunjiOjo Rasheedat Ajibade,https://t.co/40yQjDZ6Z4,,en,53,27,5,0,53205,
1719443027163312180,1669902260158038018,Tue Oct 31 19:55:38 +0000 2023,"Biology students, please whats going on here Mr Ibu Sportybet is Broke Asisat Oshoala Ronaldo John Dumelo Sportybet is Broke Mr Ibu Happie Boys Ifeanyi Piggyvest Aaron Donald Brymo Messi SLarry Asisat Oshoala Mutarisi Fubara Victor Osimhen",https://t.co/jir9zmmiXN,,en,3,2,0,4,6853,
1719439631865770405,1584212600954535936,Tue Oct 31 19:42:08 +0000 2023,Men move on fast enough from ladies who have nothing to offer and again time no day  Mr Ibu Piggyvest Asisat Oshoala Sam Larry Happie Boys Madam Koi Koi Simi Sportybet is Broke Dr. Abike DabiriErewa Presidential Villa Wike Brymo Yul Edochie Natasha Victor Osimhen,https://t.co/Eq1TioiYTZ,,en,9,7,5,2,4989,
1720175246760640895,382734577,Thu Nov 02 20:25:12 +0000 2023,Can PiggyVest pull a crowdyVest  Patricia on us ,,,en,1,0,5,0,684,
1719480391499673887,1321920709837410304,Tue Oct 31 22:24:06 +0000 2023,A follower is going home with 10k tonight. Who would it be. What can 10k do for you Mr Ibu Sportybet is Broke Asisat Oshoala Ronaldo John Dumelo Sportybet is Broke Mr Ibu Happie Boys Ifeanyi Piggyvest Aaron Donald Brymo Messi SLarry Asisat Oshoala Mutarisi Fubara,https://t.co/ehEnZJnNis,,en,65,40,72,2,34804,
1721430734919868708,1045445498243608576,Mon Nov 06 07:34:04 +0000 2023,Words on marble. PiggyVest doing the trick for me  3540 of every of my big winning goes there. I need to change it to 60 too I think .,https://t.co/loNFRT9uZ3,@_spiriituaL,en,48,8,9,1,11777,
1721846834501472260,1339959395208323073,Tue Nov 07 11:07:30 +0000 2023,"On October 31, 2023, Piggyvest released a 2023 savings report. The goal of this report which will be an annual report is to provide insights on the saving habits of Nigerians based on their gender, age and income bracket.",https://t.co/B0braxPvoj,,en,21,12,1,0,2263,
1719581781987614969,1687002242878947330,Wed Nov 01 05:06:59 +0000 2023,Caught a thief 2am this morning Asisat Oshoala Nyesom Wike Madam Koi Koi Cristiano Mr Ibu Erik Ten Hag Piggyvest Presidential Villa Sportybet is Broke Dr. Abike DabiriErewa Happie Boys Pellistri GlazersFullSaleNOW Elon ADEKUNLE THE CLOUT Pete Edochie,https://t.co/VZNPgxikIt,,en,15,4,0,0,4942,GlazersFullSaleNOW
1720486354922897826,1519689912886378496,Fri Nov 03 17:01:26 +0000 2023,Just tweet say PiggyVest or cowrywise don fold up and see them cryng ,,,en,7,4,1,0,550,
1720445168099209348,276642196,Fri Nov 03 14:17:47 +0000 2023,Is it advisable to save in dollars on Piggyvest,,,en,1,2,1,0,1316,
1720475663063245080,1532284411739312131,Fri Nov 03 16:18:57 +0000 2023,Check her PiggyVest and thank me later,,,en,3,1,0,0,327,
1719627785000370471,3212529201,Wed Nov 01 08:09:47 +0000 2023,The fact that PiggyVest users are majorly the younger demographic Nigerias future makes this the sad kind of funny.,,,en,6,3,0,0,807,
1721065954887561220,742732476582350848,Sun Nov 05 07:24:34 +0000 2023,"lord please send women like this my way, enough of these piggyvest warriors",,,en,1629,747,23,32,137890,
1719593837222580448,869530262161567744,Wed Nov 01 05:54:53 +0000 2023,Piggyvest data showed that most  residents earn less than a quarter of a million naira monthly.,https://t.co/KTXixQrWjo,,en,58,25,2,1,10627,
1718605879736414586,1138991207357517825,Sun Oct 29 12:29:06 +0000 2023,"October Dump. 1 Had the opportunity to attend NACA workshop for influencers, bloggers and journalists. 2 Was featured on PiggyVest blog. 3 Graduated University 4 I Spoke to Students in my university on how they can start a career while in school. Its been God all through",https://t.co/WoY1wZsYvc,,en,473,60,10,0,21873,
1719414371502215254,204656985,Tue Oct 31 18:01:45 +0000 2023,Its on the drum Mr Ibu Sammy Larry Piggyvest Happie Boys Cyprus Nyesom Wike Sportybet is Broke ADEKUNLE THE CLOUT Asake Presidential Villa Yul Edochie React Native Wizkid Gachagua Patricia Rufai Oseni Dubai Elon Rivers Hisbah Sultan Abati Burna Natasha Northern Nigeria,https://t.co/3ClTekVvHg,@Davido,en,43,23,21,0,18840,
1719406443030339858,1129689823890026496,Tue Oct 31 17:30:15 +0000 2023,The miracles witnessed at the Healing Stream event are beyond description it's a true testament to the phrase Rise up and walk  no doubt about it  Pastor Chris Oyakhilome Nyesom Wike Mr Ibu Happie Boys Madam Koi Koi Wizkid Piggyvest Pete Edochie Sam Larry Abati,https://t.co/657ftB6UCk,,en,68,16,6,2,10649,
1719413422649979001,187838070,Tue Oct 31 17:57:59 +0000 2023,See the bond between twins even at this early stage Asisat Oshoala Nyesom Wike Madam Koi Koi Cristiano Mr Ibu Erik Ten Hag Piggyvest Presidential Villa Sportybet is Broke Dr. Abike DabiriErewa Happie Boys Pellistri GlazersFullSaleNOW Elon ADEKUNLE THE CLOUT Pete Edochie Hisbah Murder Yul Edochie,,,en,593,151,84,9,97692,GlazersFullSaleNOW
1719417541590683668,1699299644138725376,Tue Oct 31 18:14:21 +0000 2023,Dinner  Mr Ibu Sammy Larry Piggyvest Happie Boys Cyprus Nyesom Wike Sportybet is Broke ADEKUNLE THE CLOUT Brymo Asake Presidential Villa Yul Edochie React Native Wizkid Gachagua Patricia Rufai Oseni Dubai So Elon Rivers Hisbah Sultan Abati Burna Natasha Northern Nigeria Selena,https://t.co/XcMbKbVXFm,,en,31,20,18,0,20726,
1719415560570650634,1572668565253226497,Tue Oct 31 18:06:29 +0000 2023,Federal executive meeting today they were singing  on your mandate we shall stand Is that our new national anthem Mr Ibu Sammy Larry Happie boys Sportybet is broke Pete Edochie Raila odinga Piggyvest Yul Edochie Kuda Wike Eden Hazard StopGenocideInGaza Hisbah,https://t.co/eRpCUIooOu,,en,9,8,11,1,6295,StopGenocideInGaza
1719431208197665127,1079770745570496512,Tue Oct 31 19:08:40 +0000 2023,"Don't pass without RTPLS F A Wool  Price3,500 per yard Call,DMWhatsApp 08036321855  KANO Nationwide deliver Nyeson Wike Al Nassr Happie Boys Mr Ibu Sancho Mane Ifeanyi Moniepoint Rashford 2034 World Cup Arteta Presidential Villa Pellistri Piggyvest Sportybet",https://t.co/K2Xw9jbvwU,,en,20,18,1,0,4494,
1719429070193033696,65425967,Tue Oct 31 19:00:10 +0000 2023,Done golden Mysql cheatsheets Sammy Larry Piggyvest Happie Boys Cyprus Nyesom Wike Sportybet is Broke ADEKUNLE THE CLOUT Brymo Asake Presidential Villa Yul Edochie React Native Wizkid Gachagua Patricia Rufai Oseni Dubai So Elon Rivers Hisbah Sultan Abati Burna data DataScience DataAnalytics DataScientists data DataSecurity dataviz Datavisualization dbs dbs dbd DataBreach dataprotection DataCenter DataScientists data DataSecurity dataviz Datavisualization servers server messi cr7 christianoronaldo cr7cristianoronaldo cr7fans computer computerscience web Website WebApp Web3 BigBrother DataScientists ai ArtificialInteligence ChatGPTPlus chatgpt deeplearning BusinessIntelligence Math programming,,,en,15,16,19,0,7065,data DataScience DataAnalytics DataScientists data DataSecurity dataviz Datavisualization dbs dbs dbd DataBreach dataprotection DataCenter DataScientists data DataSecurity dataviz Datavisualization servers server messi cr7 christianoronaldo cr7cristianoronaldo cr7fans computer computerscience web Website WebApp Web3 BigBrother DataScientists ai ArtificialInteligence ChatGPTPlus chatgpt deeplearning BusinessIntelligence Math programming
1719432338386337885,1676876033419538434,Tue Oct 31 19:13:09 +0000 2023,4𝗕𝗲𝗱𝗿𝗼𝗼𝗺 𝗗𝗲𝘀𝗶𝗴𝗻 We Design amp Build.  Office Loc LagosOgun state.  08131647564. Ifeanyi Togo Winco Asisat Oshoala Cameroon PiggyVest Ajibade Hollandia,https://t.co/LFJzBOxfPs,,en,17,6,0,0,1302,
1719403926787698797,1110880652407304194,Tue Oct 31 17:20:15 +0000 2023,She speaks so soft and sweet and speaks nothing but the truth on this topic. Kudos to the wonderful Ladies out there. Mr Ibu Erik Ten Hag Cristiano Sportybet is Broke John Dumelo Dr Abike DabariErewa Nyesom Wike Adaeze Happie Boys The T PiggyVest 9ice Simi Police council,https://t.co/vtsU3wJJZM,,en,49,17,5,1,14854,
1719417304339861657,1480914525469687813,Tue Oct 31 18:13:25 +0000 2023,Motivation for the night. Remember to keep pushing. Nobody said it's gonna be easy but it's gonna be worth it. Mr Ibu Sammy Larry Piggyvest Happie Boys Cyprus Nyesom Wike Sportybet is Broke ADEKUNLE THE CLOUT Brymo Asake Presidential Villa Yul Edochie React Native Wizkid Gachagu,https://t.co/Byf0FhhCrH,,en,24,16,18,0,8815,
1719382143938244978,727119609363599360,Tue Oct 31 15:53:42 +0000 2023,VEJA Motociclista tenta furar blitz no Paraguai e o inesperado acontece. Gachagua 9ice Sam Larry Cristiano Brymo October Dump Opay Diaspora Humility Cream Grammy PiggyVest Mombasa Actress Zilla NGAETH Sportybet is Broken DettyDecember Super Falcons Happie Boys just 4 Nivea,https://t.co/PZ3mxRSr3X,,ro,3,4,5,0,320,NGAETH DettyDecember
1719408162216808811,1036784011807477765,Tue Oct 31 17:37:05 +0000 2023,"Dinner is served, come and join me. I cook more than many women. Mr Ibu Piggyvest Asisat Oshoala Sam Larry Happie Boys Madam Koi Koi Simi Sportybet is Broke Dr. Abike DabiriErewa Presidential Villa Wike Brymo Yul Edochie Natasha Victor Osimhen",https://t.co/oDPTsWmMxA,,en,71,13,36,2,21510,
1719401739697234297,2876843349,Tue Oct 31 17:11:34 +0000 2023,Available     25k AbujaTwitterCommunity Nationwide . . . . . . . . . . Nyesom Wike l Presidential Villa l Sam Larry l Apology l Mr Ibu l Dr. Abike DabiriErewa Pete Edochie l Asake Piggyvest l Madina l Brymo Grammy,https://t.co/1TfCiEExZQ,,ht,19,20,1,0,844,AbujaTwitterCommunity
1719430669623763087,1079770745570496512,Tue Oct 31 19:06:31 +0000 2023,"Don't pass without RTPLS Geekay Wool  Price4,500 per yard Call,DMWhatsApp 08036321855  KANO Nationwide deliver Nyeson Wike Al Nassr Happie Boys Mr Ibu Sancho Mane Ifeanyi Moniepoint Rashford 2034 World Cup Arteta Presidential Villa Pellistri Piggyvest Sportybet",https://t.co/fS9a45SOC6,,en,11,16,0,0,3723,
1719416139061641587,1533773454914293761,Tue Oct 31 18:08:47 +0000 2023,Even Egbon Dey collect DND So calm down Mr Ibu Wizkid Explosion Asisat Oshoala Nyesom Wike Piggyvest Sam Larry Happje Boys Natasha Cream Pete Edochie Burna Hisbah Asake Rema Brymo ILEBAYE ODINIYA John Dumelo Penaldo Patricia NoOilForIsrael CeasefireForGaza Trump Ronaldo,https://t.co/WzOTWHMgXm,,ro,55,3,5,0,5523,NoOilForIsrael CeasefireForGaza
1719389758504280446,3557364256,Tue Oct 31 16:23:57 +0000 2023,Whats going on at the back  PakistanCricket swfc HappyHalloween Mr Ibu Sam Larry Cristiano Ronaldo Wizkid Opay Sportybet is Broke Brymo Shameless Piggyvest Apology Joeboy 9ice Yahaya Bello Kuda,https://t.co/t8Ktkc9t5P,,en,2,4,1,0,2346,PakistanCricket swfc HappyHalloween
1719405736139092115,931685630035333121,Tue Oct 31 17:27:27 +0000 2023,It cost you 0.0 worries to Retweet my business  Price20k Location kaduna state WhatsAppcall07066553389 Nationwide delivery  RIPMpilo Asisat Oshoala Mr Ibu Cristiano Ronaldo Madam Koi Koi Simi Brymo Piggyvest,https://t.co/AtwsVVABaO,,tl,23,20,4,1,3469,RIPMpilo
1719403311860683018,1584849632047267841,Tue Oct 31 17:17:49 +0000 2023,"A packed up day like Dec 27th is always amazing, considering what time of the year it would be. We feast soon . Agbor Presidential Villa Benin Brymo Burna Messi Afronation Sportybet is Broke Happie Boys Grammy Mr Ibu Asisat Oshoala Cristiano Sam Larry Wizkid Piggyvest",https://t.co/PWMinjlgqt,,en,31,23,5,0,15076,
1719359633079378220,175055258,Tue Oct 31 14:24:15 +0000 2023,PiggyVest Savings Report. Only 6 Of Nigerians earn above 1m a month. 87 of respondents spend most on food and groceries People are saving more for Japa than childcare and cars. Most people are indebted to friends and family members more than financial institutions.,https://t.co/VYmebbKw3y,,en,26,28,3,13,12317,
1716146005152821446,2822619947,Sun Oct 22 17:34:26 +0000 2023,He Went up as a child came down a grown ass man going straight to file a lawsuit  Mr Banks Atiku Abuja Airport Biafra Deport Piggyvest David Hundeyin Southern Kaduna Ben Bruce Abia Northerners West Bank Dr Ayo Tacha HallelujahChallenge Igbos,https://t.co/i5cLKdL6X9,,en,6,1,0,0,2388,HallelujahChallenge
1715749674529796592,377294741,Sat Oct 21 15:19:34 +0000 2023,"I spoke with , cofounder of PiggyVest in a very insightful 18minute conversation on The Leaderboard. Go WATCH Reposts Appreciated ",https://t.co/dxHW1xcjsb,@OdunEweniyi,en,1493,512,31,69,545691,
1716145883698409936,799413071185899520,Sun Oct 22 17:33:57 +0000 2023,When ever I try to fix my problem alone  Abuja airport Bukayo Saka Atiku congratulations Banks Nedu special One piggyvest Vieira west ham Ben Bruce Erik Ten Hag southern Kaduna Mourinho Arsene Wenger Kudus Mikel Arteta time makinwa Ollie Watkins paqueta,https://t.co/b0xBB8YUs6,,tl,3,2,0,0,476,
1717426463522091173,1266608901346209793,Thu Oct 26 06:22:31 +0000 2023,"Ogun Digital Summit Day. Join us today by 9am at Eagle Hall top floor, Providence Event Centre, MKO Abiola Way, Leme, Abeokuta. Keynote Speakers 1. Odunayo Ewebiyi  Cofounder  CEO piggyvest. 2. Bayo Omoboriowo Official Photographer to the President of Nigeria 20152023. Please share.",,,en,22,15,2,1,6304,
