tweet_id,user_id,created_at,text,url,mentions,lang,favorites,retweets,replies,quotes,view_count,hashtags
1680568226902581248,208238270,Sun Jul 16 13:21:03 +0000 2023,"I use PiggyVest to save amp invest securely. Sign up with my link and get 1,000.00 to start your own savings journey ",https://t.co/qcughdBATa,,en,0,0,0,0,23,
1680300656748380162,1326179008975876097,Sat Jul 15 19:37:49 +0000 2023,Setting a target on piggyvest be like say you want join cult ,,,en,1,0,0,0,26,
1681302357580328960,1053032864013570050,Tue Jul 18 13:58:13 +0000 2023,Piggyvest here i come,,,en,3,0,0,0,322,
1680831107112026113,570043547,Mon Jul 17 06:45:38 +0000 2023,"Abeg which business I fit start with 15,565 my piggyvest safelock don open after 1 year ",,,en,3,1,1,0,177,
1678346598361833474,1159348924177637378,Mon Jul 10 10:13:05 +0000 2023,My money hasnt gotten to PiggyVest since yday and I cant breathe.,,,en,1,1,3,1,815,
1678857044932063233,1213969251171590144,Tue Jul 11 20:01:25 +0000 2023,I really thank God for piggyvest in my life.,,,en,2,0,0,0,207,
1681353820037693449,2234418034,Tue Jul 18 17:22:43 +0000 2023,"I dont even have tfare for work and I am going to watch a movie Being broke and spending frivolously, lemaooo I will have to break my PiggyVest ",,,en,1,0,0,0,242,
1680583168850550784,2340060418,Sun Jul 16 14:20:25 +0000 2023,"Ngl, the GTBank app is v. cute and its not another PiggyVest copy.",,,en,23,1,3,0,4564,
1679920072851062784,1668924980174675968,Fri Jul 14 18:25:31 +0000 2023,How many likes for your piggyvest savings account ,,,en,22,0,1,1,28253,
1675197818661732354,2822619947,Sat Jul 01 17:40:58 +0000 2023,Nigerians breaking new records... soccer football.. TwitterDown Charly Boy MC Oluomo Anambra Igbo Amaka Handsome PiggyVest Jason Statham Blood Diamond,https://t.co/cm6CbmbX2I,,en,8,1,1,0,1985,soccer football TwitterDown
1675189946565505157,2822619947,Sat Jul 01 17:09:41 +0000 2023,Skit though but still very funny with lessons learned... TwitterDown Charly Boy MC Oluomo Anambra Igbo Amaka Handsome PiggyVest Jason Statham Blood Diamond,https://t.co/y9lZRUqI6h,,en,6,1,0,0,2549,TwitterDown
1675193422582362112,1209596638274215937,Sat Jul 01 17:23:30 +0000 2023,"Kindly Retweet I Have These In Store NEW EDITION BRANDED SNEAKERS SNEAKERSSLIDES TRENDS Frame 160,000 Frame 260,000 Kindly Send A Dm or WhatsApp 07084240179 Delivery Nationwide Handsome Piggyvest Anita MC Oluomo Wizkid Davido Burna Fireboy TwitterDown JPEGs Baddest",https://t.co/NvbWxWDMZi,,en,1,0,1,0,836,
1675187266954698753,1283184552782028801,Sat Jul 01 16:59:02 +0000 2023,See how beautiful the sound engineer made her vocals show how extra ordinary and sweet to listen to our Celestial Being. No near Ayra Starr when it comes to her vocal but encourage the sound engineers to do better Fireboy  Piggyvest  Handsome  Pere,https://t.co/lrvTEVSPBY,,en,7,3,0,0,3245,
1675179308229197829,1322672447578132480,Sat Jul 01 16:27:25 +0000 2023,Piggyvest swallowed my 20M interest,,,en,13,5,4,0,2542,
1676548149417070592,1406245017652502533,Wed Jul 05 11:06:42 +0000 2023,Piggyvest  Your autosave of 500 didn't go Did you put money there,https://t.co/77rYHPUA2V,,en,41,12,2,7,3668,
1676589261598908418,1438625051662761985,Wed Jul 05 13:50:04 +0000 2023,"Spend this money faith.. All that money in your piggyvest, spend it to enjoy yourself.. Next of kin no like Zuma rock oo",,,en,2,1,1,0,671,
1675238471802265602,1372228446710038530,Sat Jul 01 20:22:30 +0000 2023,This new Piggyvest app is annoying ,,,en,3,0,3,1,1221,
1676160404832043010,1605510539752382464,Tue Jul 04 09:25:56 +0000 2023,PiggyVest when you go disburse referral money nau.,,,en,5,0,4,0,427,
1675904509065805824,272038491,Mon Jul 03 16:29:06 +0000 2023,"Not my mother calling me to tell me that her friends are sending her the link to my interview on PiggyVestOpera. Shes asking me why I wasnt the first person to send her the link She said shes reading it with my dad, and will critique it My parentssssss gtgtgtgtgt",,,en,148,5,2,0,4703,
1677801153264795649,2709437336,Sat Jul 08 22:05:41 +0000 2023,Na PiggyVest and Cowrywise dey help them save am.,,,en,3,0,3,0,594,
1675178993534791686,1218632545346183170,Sat Jul 01 16:26:10 +0000 2023,Sometimes its hard to see the good because its in the ugly Title Stranger Size 16x24 Artist me TwitterDown Opay Sheggz Handsome Fireboy PiggyVest Rate Limit Exceed,https://t.co/dnjqYk7YBD,,en,6,0,1,0,2114,TwitterDown
1675138051989798914,1050663866089127936,Sat Jul 01 13:43:28 +0000 2023,God PiggyVest is pissing me offffff,,,en,0,0,1,1,739,
1676131090631720961,3728712495,Tue Jul 04 07:29:27 +0000 2023,Come Make una no Dey mention piggyvest like that. My chest,,,en,0,0,1,0,200,
1676174995192463361,941344768411492352,Tue Jul 04 10:23:55 +0000 2023,"I dont know, man. I just want to use my PiggyVest as PiggyVest, it was good amp very functional. This redesign that makes it so similar to Pocket is extremely stressful.",,,en,100,36,8,12,16754,
1676092520890081281,1099613892622385152,Tue Jul 04 04:56:11 +0000 2023,Whats with PiggyVest getting crashed that I have been seeing everywhere.,,,en,3,1,1,0,466,
1675242801582202880,1050663866089127936,Sat Jul 01 20:39:43 +0000 2023,It cant be well with PiggyVest btw,,,en,2,2,1,0,1017,
1678013924921294848,1386907220965797888,Sun Jul 09 12:11:10 +0000 2023,Did anything happen to the piggyvest app I can't find it on Google play store,,,en,0,0,2,0,182,
1675174137868742656,1626255827911729152,Sat Jul 01 16:06:52 +0000 2023,"PiggyVest I dont like what I dont like, please return my interest ",,,en,3,0,2,0,566,
1675544499085365249,3049347597,Sun Jul 02 16:38:33 +0000 2023,I need to be serious with my piggyvest. This one that weve planned a trip December and shi shi I no get ,,,en,1,0,1,1,784,
1671954945468235794,334899816,Thu Jun 22 18:54:57 +0000 2023,Hey Twitter NaijaI am an independent filmmaker creating short contents and I just created this short inspired by vision pro and I think youll like it kindly Rt so someone can see my work  Titanic  Fireboy  PiggyVest,https://t.co/nl4IMucmgB,@Apple,en,42,19,1,0,3478,
1674544595202449409,811086947003355136,Thu Jun 29 22:25:17 +0000 2023,"SMEs are using Opay Uber people are using Opay POS people are using Moneypoints POS Filling stations are using Accelerexs POS Online vendors are using FVD Tech people are using Kuda All the women have Piggyvest All the men have Bamboo, Cowrywise or Risevest but they also have Piggyvest Youngies like Kuda Some people have at least 2 food ordering apps",,,en,1484,306,134,43,310139,
1674814958352171010,815979346846482432,Fri Jun 30 16:19:37 +0000 2023,Piggyvest is steady winning this email marketing thing,https://t.co/33qBMePYVp,,en,6,0,0,0,2297,
1671939671461429248,418036764,Thu Jun 22 17:54:15 +0000 2023,PiggyVest is trending ke ,,,lt,3,1,1,0,254,
1674308001820205056,911078310674710529,Thu Jun 29 06:45:09 +0000 2023,Between Piggyvest and Cowrywise which is more Reliable for Saving ,https://t.co/2GqZou5Si1,,en,18,11,17,0,9491,
1674677668782981120,371156597,Fri Jun 30 07:14:04 +0000 2023,PiggyVest released a new version of their app and its been all buggy. So frustrating ,,,en,26,5,2,1,5405,
1672754719167590401,226022176,Sat Jun 24 23:52:57 +0000 2023,What is this scatter scatter update PiggyVest did to its app,,,en,2,0,1,0,312,
1675116882804842496,2659270834,Sat Jul 01 12:19:21 +0000 2023,Can someone explain to me how piggyvest works,,,en,1,0,0,0,342,
1674528256534380545,1227870926768922624,Thu Jun 29 21:20:22 +0000 2023,Mide send me ur piggyvest account.,,,en,1,0,4,0,448,
1672629144281141251,2943391660,Sat Jun 24 15:33:58 +0000 2023,Anybody else having problems w the PiggyVest app,,,en,1,0,2,0,438,
1671954908805754880,914610224497025024,Thu Jun 22 18:54:48 +0000 2023,Regretfully announcing the death of the crew. My their soul rest in peace.  This should be a lesson. Let the past be past. Let the Titanic Ship be the past. So sad OceanGate The Russians Steve Harvey PiggyVest INEC Doggy Titanic,https://t.co/a1tMB8vM33,,en,3,1,0,0,1397,OceanGate
1674457936918196236,1132076846529613830,Thu Jun 29 16:40:56 +0000 2023,This PiggyVest new UIltltltltltltlt,,,en,3,2,1,0,1747,
1671953988068016149,4112852957,Thu Jun 22 18:51:08 +0000 2023,INEC will never mess with Nigerians again How dare you delete FCT BVAS when election was not supposed to happen there INEC is a criminal organization headed by Mahmoud Yakubu FCT 25 is mandatory. Arise TV Bulaba Tinubu seme Piggyvest Doggy Victor Osimhen Chi Chi Hermes,https://t.co/dhYyiZQ7sL,,en,19,6,0,0,11536,
1672411218957463552,1024592349274537984,Sat Jun 24 01:08:01 +0000 2023,Cowrywise gtgtgtgt Piggyvest,,,ro,1,0,0,0,152,
1670880372299579392,857741244864352256,Mon Jun 19 19:44:58 +0000 2023,How Are Nigerians Negotiating For Higher Pay  Piggyvest Blog,https://t.co/FpGT3GdF0i,,en,2,2,0,1,555,
1673395742499545090,955695544474722304,Mon Jun 26 18:20:09 +0000 2023,"So, one of my banks sent me a mail this evening with the title, Higher Rates on Your Savings Account. I decided to open it and I laughed when I saw the rates Old rate 5.40 New rate 5.55 Why should I leave my money in the bank when the likes of Piggyvest, Cowrywise,",,,en,95,4,3,0,5323,
1674810855274291203,4089416410,Fri Jun 30 16:03:19 +0000 2023, piggyvest ,,,lt,39,11,8,0,9276,
1673083574449258497,1196377835746795520,Sun Jun 25 21:39:43 +0000 2023,I go give u 10M in my Piggyvest if you win am,,,en,265,21,19,1,42597,
1673792555786424322,877919194809065472,Tue Jun 27 20:36:57 +0000 2023,You people mean theres no way to break PiggyVests safelock,,,en,0,0,2,0,810,
1675090401458356225,739913234979901444,Sat Jul 01 10:34:08 +0000 2023,PiggyVest reduced my interest rate from over 1k to 54 naira. I dont even have strength this morning but you people should continue ,,,en,0,0,2,0,1365,
1669440773094363152,2760372023,Thu Jun 15 20:24:31 +0000 2023,Piggyvest plzzz nauuu,https://t.co/Y5zJszCX6t,,tl,9,2,1,0,1014,
1669668433175216130,909049288273092614,Fri Jun 16 11:29:10 +0000 2023,"Na the Piggyvest owner go send asasi make person die amp dem inherit the money, I no dey fix for long, my money is not useful in the account, make I dey see am with my korokoro eyes better Real Estate Import amp Exports Landed Properties LivestockMechanized Farming",https://t.co/HaXVvMrqx9,,en,18,8,1,0,3011,
1669440896436420608,1890266070,Thu Jun 15 20:25:01 +0000 2023,"Aimed at having eye for good design, how design principles can be applied in User interface design, I redesigned the PiggyVest financesaving management application pixel for pixel. uidesign uiuxdesign userinterface",https://t.co/to2BR65Icq,@PiggyBankNG,en,10,5,1,0,598,uidesign uiuxdesign userinterface
1670054803966181376,815979346846482432,Sat Jun 17 13:04:28 +0000 2023,"I got 7 of 10 right, and you PiggyVest via ",https://t.co/BTfW2BGXYp,@PiggyBankNG,en,0,0,0,0,85,PiggyVest
1670001379576889344,1053306132897370112,Sat Jun 17 09:32:10 +0000 2023,"Can't believe this is a pr tweet, subbing piggyvest to promote vbank or what ever, so dull and poor from you and everyone involved",,,en,0,0,0,0,145,
1669648726032351232,697578443106557952,Fri Jun 16 10:10:51 +0000 2023,"For a Scheme made for Nigerians by Nigerians, it seems that PiggyVest is far removed from the Nigerian Reality to be suggesting this.",,,en,33,8,2,1,3732,
1669573501374611456,1196377835746795520,Fri Jun 16 05:11:56 +0000 2023,Lol Piggyvest so funny Saved 15M for 6 months and interest was 440K You mean if I did business with that for 6 months I wont make a million You are actually mad,,,en,7976,957,738,611,2338755,
1669438202917146649,1229255048510742528,Thu Jun 15 20:14:18 +0000 2023,"lmao, piggyvest isn't even decent, doesn't actually stop you from spending because you can withdraw your money anytime you feel like. its like a glorified bank account.",,,en,0,0,0,0,114,
1667120944807124997,1629379960401018881,Fri Jun 09 10:46:21 +0000 2023,Which one is that one in PiggyVest where you cant withdraw your money even if heaven is falling down Is that Target or Safelock,,,en,0,0,6,0,602,
1670330408561528832,1199898356539101184,Sun Jun 18 07:19:37 +0000 2023,Omo I withdraw money from my piggyvest I no see am ah,,@PiggyBankNG,en,0,0,2,0,147,
1669619397210546177,1072162127920664577,Fri Jun 16 08:14:18 +0000 2023,I'm sensitive about piggyvest cz they have all my money saved there. I'm sensitive about them same way I'm sensitive about Peter Obi. thread lightly I swr,,,en,2,1,0,0,295,
1669674109288980480,304671272,Fri Jun 16 11:51:43 +0000 2023,"Why you no carry the money do business instead of putting it in piggyvest You left a 15m on a platform without any stress and 6 months later, you got an interest of 440k on it and you're complaining. Na why Ponzi scheme dey thrive for Nigeria be this.",,,en,1,0,0,0,102,
1670110347062046722,1247504401402642432,Sat Jun 17 16:45:10 +0000 2023,"Piggyvest is now slow,before you get your money ur eye go don turn red from hunger ",,,en,5,0,1,0,300,
1670672278076510213,1206456081922310144,Mon Jun 19 05:58:05 +0000 2023,"PiggyVest, hope no problem.",,,en,1,0,1,0,190,
1670083015215575040,1260523978843656192,Sat Jun 17 14:56:34 +0000 2023,Piggyvest knw say wetin dey talk no make sense.. See the caption  I'm just sayin,https://t.co/5nkR3126ES,,en,42,22,4,1,2071,
1669457462678650883,3297150710,Thu Jun 15 21:30:50 +0000 2023,"Piggyvest, 5k from where",,,en,1,1,0,0,401,
1669806952749182977,169043585,Fri Jun 16 20:39:35 +0000 2023,If I were Piggyvest. This is what is post. ,https://t.co/TdmxnXSu6b,,en,1,1,1,0,1389,
1668566375424577542,888179293251133440,Tue Jun 13 10:29:59 +0000 2023,1. Pay tithe and bills early. 2. Save a percentage of everything you spend for the rainy days Kuda helps with this 3. Do a daily autosave on Piggyvest. No matter how little. 4. Cook in bulk. 5. Do what you can about black tax. 6. Trust God.,,,en,6,2,0,0,759,
1669644976123269120,823607995,Fri Jun 16 09:55:57 +0000 2023,Idg you didnt see business to start before you put the money in the PiggyVest,,,en,36,7,4,1,4331,
1666164278968164352,1546300904957251584,Tue Jun 06 19:24:54 +0000 2023,"It's not Thursday yet, but we are throwing it back to when we did a thing for Piggyvest's 7th anniversary early this year. It was planned and executed to perfection What a time ",https://t.co/BuDO1ieNGJ,,en,10,5,0,0,1819,
1665690257524764674,1272448813475811329,Mon Jun 05 12:01:19 +0000 2023,How is my account automatically tweeting this piggyvest shiii  ,,,en,0,0,0,0,82,
1666735192122204161,1228008559033683968,Thu Jun 08 09:13:30 +0000 2023,I shared last week that I'm currently recreating the Piggyvest UI design. Here is the home page UI. This took a lot of effort to figure out. uidesign productdesign ImprovingMyUIDesign,https://t.co/vWJ2wK9Rhg,,en,9,5,0,0,488,uidesign productdesign ImprovingMyUIDesign
1815873126737015032,1136421843777269760,Tue Jul 23 22:14:25 +0000 2024,"Hear me out My man N990,000 My piggyvest N5,000 Guiding N5,000",,,en,4721,1481,234,341,561309,
1664613198979297282,87170426,Fri Jun 02 12:41:28 +0000 2023,If youd like to donate used appliances please DM me You can send money directly to her no matter how small. Her PiggyVest details  Account number 8374402902 Bank name Sterling Bank Nigeria can happen to anyone but its nice to know we got each other ,https://t.co/IAOhO7dfWn,,en,32,73,1,0,11998,
1817511015459824109,209175780,Sun Jul 28 10:42:48 +0000 2024,PiggyVest has the best UX in any finance app in Nigeria.,,,en,0,0,0,0,221,
1817501350030102628,1155597966331265024,Sun Jul 28 10:04:24 +0000 2024,"I dont understand what Gtb is telling me, where is my money . I was debited immediately on piggyvest, how come Gtb is telling me they cant find my money Wo, you people should not test me o. Provide my money.",https://t.co/uIjd4Qbrj9,@PiggyBankNG @gtbank_help @PiggyBankNG,en,7,4,3,4,993,
1817891989272080880,1318654233873448960,Mon Jul 29 11:56:39 +0000 2024,Like how my unto save is no longer working on PiggyVest is not funny,,@PiggyBankNG,en,0,0,0,0,24,
1664349527384420352,1022207647095947265,Thu Jun 01 19:13:44 +0000 2023,Piggyvests safelock option is a life saver.,,,en,25,12,4,17,28763,
1664190739834650624,293536748,Thu Jun 01 08:42:46 +0000 2023,"Buy PowerBank Incase you no see Fuel Buy  Brand New Mi Fast Charge powerBank available  10,000 Mah  12K 20,000 Mah  20K 30,000 Mah  30K Kindly send a DM to place your orders   08153000204 Pls help Retweet  Dollar NYSC PiggyVest Ojota President Naira Tinubu Devalue Godwin Talented AA Rano Seun Zino Mayor Seyi Vibes",,,en,14,28,1,0,2119,
1817952130868687231,1540363422935687168,Mon Jul 29 15:55:38 +0000 2024,Its reviews I came to look for o. Abeg o. Let me kuku keep the money in PiggyVest till its complete.,,@egbokavictory_,en,0,0,1,0,13,
1817958969069158758,1772630037646188544,Mon Jul 29 16:22:48 +0000 2024,"Well, Durex would have been way more affordable than abortion. My advice Partner with piggyvest because if you do abortion for pesin wey no dey game before and she kpai, my brother na jail o. Anyways, congratulations in advance, papa Ikimo.",,@Wizarab10,en,0,0,0,0,12,
1817662882148200584,283578683,Sun Jul 28 20:46:16 +0000 2024,"Hmm, so I know PiggyVest had already acquired abeg pre that event. Not discounting that theyre not as successful as expected, just saying the sale happened before big brother, it just wasnt made official for a while.",,@henryars_,en,1,0,1,0,39,
1817360343078690869,1280072108165468160,Sun Jul 28 00:44:05 +0000 2024,"My next step. After winning millions, piggyvest  savings way abeg",,@george__picks,en,0,0,0,0,39,
1817264673277792542,735591713897611266,Sat Jul 27 18:23:55 +0000 2024,"I no fit stay house wey rent go even make me dey panic, once its 60 days away, Ill have it somewhere inside inside hope you understand PiggyVest  To me, if your rent makes you panic, then youre living way above your means. My own POV Nothing dey Aza now but zero panic",,@AjeboDanny,en,0,0,0,0,35,
1816230887018881157,176394559,Wed Jul 24 21:56:02 +0000 2024,I need Engineers to understand building a product is usually the easiest part of the engineering journey. Scaling it is another ball game You can build a piggyvest in maybe a month or less say youre a 10x engineer. That doesnt mean you can build THE piggyvest that currently exists in the market,,,en,148,65,11,15,27186,
1816752148937687058,311609543,Fri Jul 26 08:27:20 +0000 2024,What do you know about PiggyVest,https://t.co/qAQHrYMKQl,,en,19,3,19,0,1141,
1817284363127488761,1579418650733383681,Sat Jul 27 19:42:10 +0000 2024,I dont know why piggyvest is hard for me to use,,@PiggyBankNG,en,0,0,0,0,110,
1817296786932806033,1775325960109215744,Sat Jul 27 20:31:32 +0000 2024,My money still with piggyvest sef for years now since I lost my number,,@PiggyBankNG,en,0,0,0,0,53,
1663186635217944579,2339157490,Mon May 29 14:12:49 +0000 2023,Piggyvests new UI has that PocketApp feel all over it. They did a great job. Well done to the whole team ,,,en,37,7,3,3,5656,
1662246770338848774,200864307,Fri May 26 23:58:07 +0000 2023,Some of them  bronze   abeg piggyvest,https://t.co/mCy2L9SMp0,@mr_fikayo @IamYimika_,en,4,3,1,0,1046,abeg piggyvest
1661131947693727752,1051882719079215105,Tue May 23 22:08:13 +0000 2023,"Checked my piggyvest now Olabode, nah like this I go do December for Seychelles  Its looking blurry",,,en,13,2,1,1,751,
1663926155504672768,996427260185010176,Wed May 31 15:11:24 +0000 2023,This new piggyvest app looks so nice.,,,en,2,0,0,0,215,
1663661016427687937,739913234979901444,Tue May 30 21:37:50 +0000 2023,My PiggyVest updated itself and logged me out. Now I have to put the phone number I used to register it and I cant remember. Blood of Jesus Christ ,,,en,2,1,3,0,856,
1663204894428352513,1168616476066099200,Mon May 29 15:25:22 +0000 2023,"piggyvests new app ui is so pretty, best in using colors fr very neat design. i see components from pocket app.",,,en,42,5,2,0,3645,
1662031027210952704,897844583618547712,Fri May 26 09:40:50 +0000 2023,Advice for women entering the tech business from Piggyvest cofounder Odun Eweniyi. Tag a woman in your circle.   Founders Connect,https://t.co/LpQbPqstMC,,en,4,3,0,0,887,
1663826028282671105,1253990820203712513,Wed May 31 08:33:32 +0000 2023,I and piggyvest are besties fl,,,en,3,0,2,0,637,
1664029295856046083,1013151764424658944,Wed May 31 22:01:14 +0000 2023,I didnt even know piggyvest has upgraded their app o I say make i collect my monthly interest. The app is soooo sleek,,,en,7,1,0,0,716,
1663501713112809472,144222790,Tue May 30 11:04:49 +0000 2023,Charge from day one.  PiggyVest's Odunayo Eweniyi on how to run your startup on a tight budget,https://t.co/CDeMENEft9,,en,427,118,7,17,66051,
1660729328143851520,711584067,Mon May 22 19:28:21 +0000 2023,"The aunty with the tiny waist chain at 101, Im willing to break my PiggyVest target savings for youuuuu",,,en,1,0,1,0,532,
1663618403150512128,1267395904715325441,Tue May 30 18:48:30 +0000 2023,love the new piggyvest ui abi na ux,,,en,0,0,2,0,376,
1663559180245139457,1072561702779150336,Tue May 30 14:53:10 +0000 2023,I wanted to safe lock my sis birthday gift money till July and piggyvest some how shifted it till September ,,,en,14,6,4,1,1379,
1659827939494567937,1371151343063293953,Sat May 20 07:46:33 +0000 2023,"The PIGGYVEST CoFounderCOO, Odunayo Eweniyi is one of our Masterclass Facilitators at the Lagos Startup Expo today make sure you come.",https://t.co/Ya5T13fOHF,,en,0,0,0,1,195,
1663211893069053953,1164310506615791622,Mon May 29 15:53:10 +0000 2023,This PiggyVest design update. CLEAN.,,,en,35,6,5,0,4627,
1663284219013914626,1505627946551332865,Mon May 29 20:40:34 +0000 2023,"PiggyVest how fa, this new update",,,en,2,0,1,1,2198,
1662936620058673153,1146178972591513600,Sun May 28 21:39:20 +0000 2023,How do you save your money Don't say piggyvest,,,en,1,1,3,1,2708,
1663836778103463937,876228806213808131,Wed May 31 09:16:15 +0000 2023,Opened piggyvest this morning to look at the light at the end of the tunnel and I realised them don thief my bulb,,,en,12,2,5,10,4357,
1664179780202254338,870610350,Thu Jun 01 07:59:13 +0000 2023,I dont understand this new PiggyVest app o.,,,en,1,1,1,0,524,
1656001280295292928,219571619,Tue May 09 18:20:46 +0000 2023,"Loool just reminds me of those Truppr tech football tournaments where Paystack, Piggyvest teams will bring soft GenZ tech bros devs, PMs, etc then Tizeti will bring the people that install their WiFi, Paga will bring their agents ",,,en,2268,763,104,151,576787,
1659486888019865662,1521157195848683520,Fri May 19 09:11:20 +0000 2023,Na everytime I dey remove 5k from my PiggyVest. Savings go soon finish,,,en,14,1,6,0,551,
1656400726283698178,1242811838263439361,Wed May 10 20:48:02 +0000 2023,"PiggyVest, una no go vex this month o target o, auto save o, flex o, mo sorry.",,,en,3,0,1,0,317,
1656573521995132929,900967474031583232,Thu May 11 08:14:39 +0000 2023,PiggyVest people ,,,en,3,0,1,0,447,
1655834938665467911,883022425914564609,Tue May 09 07:19:47 +0000 2023,"Lol. Did they factor in fintechs like Piggyvest, Cowrywise and the rest where idans dey lock their money",,,en,2,1,0,0,383,
1654877721640484865,136263953,Sat May 06 15:56:09 +0000 2023,Your PiggyVest account nko,,,en,2,1,2,0,634,
1656282453722398720,811086947003355136,Wed May 10 12:58:03 +0000 2023,But omoooo Piggyvest na big company oooo.,,,tl,308,13,10,5,36144,
1659823657269460994,1540988546298875905,Sat May 20 07:29:32 +0000 2023,"PIGGYVEST CoFounderCOO, Odunayo Eweniyi is one of our Masterclass Facilitators at the Lagos Startup Expo today. Register to attend using link below",https://t.co/IlzEGTDfqh,,en,0,0,0,0,38,
1656242897337954309,144222790,Wed May 10 10:20:52 +0000 2023,Daniel wears his excitement on his sleeves when talking about how much satisfaction hes getting from leading content strategy at Piggyvest. ,https://t.co/AY33gOdBWU,,en,51,20,2,2,15571,
1655290205836910594,901437504401932288,Sun May 07 19:15:13 +0000 2023,"If Im earning 400k, Ill put 350k in my PiggyVest, use 50k to open a tab for my man with his fave clothing vendor then we will be spending his money for the rest of the month",,,en,181,47,7,26,56318,
1656614382065917956,1221456620288454657,Thu May 11 10:57:01 +0000 2023,"Shitcoin szn, losers dey plenty pass winners, dem no just dey loud am ni. Instead make you lock your money for PiggyVest, you dey ape in up and down and dem dey dump on your papa",,,en,0,0,2,0,322,
1658480870452494339,1248569931945435140,Tue May 16 14:33:47 +0000 2023,Even Piggyvest is crying ,,,en,0,0,1,0,407,
1658409463773052928,944711577219096579,Tue May 16 09:50:02 +0000 2023,Girls are always broke until you check their piggyvest.,,,en,70,23,22,8,8018,
1658103884445876225,1562147918613778434,Mon May 15 13:35:46 +0000 2023,"Dear PiggyVest, lets talk. I gree say na me do mistake lock my savings but just give me 20k inside my savings abeg. If I no return am make I naked baff. Abeg.",,,en,8,3,3,0,1195,
1657325276206968832,1570551182,Sat May 13 10:01:52 +0000 2023,"One might just need to find another savings app to replace , coz I dont see the reason to continue to use piggyvest when their auto save feature has not worked for about 2 months now, and still nothing has been done about it. Even with all the complaints",,@PiggyBankNG,en,0,0,3,0,228,
1657761946765086722,1254836028424237058,Sun May 14 14:57:02 +0000 2023,staring at your piggyvest balance as therapygtgtgt,,,en,2,1,3,2,2004,
1656983678071840769,1196005801925758976,Fri May 12 11:24:28 +0000 2023,"Since January, any money I make I split it into 2 and save a part in my piggyvest lock. Sometimes I will be broke then I remember my money in piggyvest ",,,en,1,1,3,0,293,
1654200732134920201,2602197374,Thu May 04 19:06:02 +0000 2023,I honestly have PiggyVests time today. Worse customer service ever.,,,en,2,0,3,0,851,
1658378778081476608,3307307391,Tue May 16 07:48:06 +0000 2023,"Women get money die. You won't know because you are looking at their accounts. The monies are inside piggyvest, cowrywise, and the 14 different thrift contributions that they are in.",,,en,28,8,26,11,5961,
