tweet_id,user_id,created_at,text,url,mentions,lang,favorites,retweets,replies,quotes,view_count,hashtags
1763673220371116069,1032927402811371526,Fri Mar 01 21:10:37 +0000 2024,Last month was great because of your patronage with us at Adun Dental Clinic. We wish you a Happy New Month and a month filled with Happiness and smiles as always . Tags Rest in Peace Timini Anikulapo Hiccups Piggyvest The Central Bank of Nigeria Kano Binance Finidi George,https://t.co/74YNban71p,,en,5,3,0,0,1622,
1763527838177673510,761166152240332800,Fri Mar 01 11:32:56 +0000 2024,Evonne Piggyvest they pay interest o.,https://t.co/5Es2SmG21U,,en,3,0,4,0,1967,
1760030139155403184,1245400253773348865,Tue Feb 20 19:54:19 +0000 2024,I'm sorry If you don't understand Yoruba  . . . . . Ikotun PiggyVest Good In Bed NigeriaProtest,https://t.co/DIOzgTUKNv,,en,30,14,5,0,16040,NigeriaProtest
1760049823611277710,762915766870085632,Tue Feb 20 21:12:32 +0000 2024,Cargo pant is available for 15k  Lagos NigeriaProtest Corper Xavi CarabaoCupFinal opay Naira Toyin Abraham Ikotun Davido Asake Greenwood IStandWithTinubu Jada NigerianGovt Regha Brentford Chioma Brentford Good In Bed Fuel Bashir Ageshinkole Piggyvest BDCs,https://t.co/7994KA4YCZ,,en,3,1,1,0,3769,NigeriaProtest CarabaoCupFinal opay IStandWithTinubu NigerianGovt
1760001338270781646,1213815662583222273,Tue Feb 20 17:59:52 +0000 2024,"Dear Twitter users, Im asking for 2 seconds of your time today to help RETWEET my art.  . . . PiggyVest",https://t.co/yjfw9lxsl5,,en,37,21,2,2,6764,
1760015167901904929,135841640,Tue Feb 20 18:54:50 +0000 2024,He is doing his best to really impress her Shettima iPhone 16 Nigerians Tinubu Vatican II PiggyVest Toyin Abraham Vatican II USDT Pooja Abuja,https://t.co/qSoP8ZDqo6,,en,2,1,0,0,1533,
1760022819273093277,884510472,Tue Feb 20 19:25:14 +0000 2024,Reports say people stopped a truck owned by Dangote and took everything from it. . . Moses Bliss Good In Bed CarabaoCupFinal Opay Naira Mercy Aigbe Toyin Abraham PiggyVest Asake Ikotun Davido David Adeleke,https://t.co/BhUfk1PnR4,,en,12,6,1,1,6511,CarabaoCupFinal
1760017226487476494,884510472,Tue Feb 20 19:03:00 +0000 2024,The trainings of our kids really speaks for itself . . Moses Bliss Who TF Did I Marry Dear HR Carabao Cup Mercy Aigbe Toyin Abraham PiggyVest 1 CAD IPhone 16 Ikotun Davido,https://t.co/SxmbdiinLD,,en,25,12,7,3,6420,
1760034169860841490,215043698,Tue Feb 20 20:10:20 +0000 2024,"I can't believe this guy and his band, who are visually impaired, singing Asake in a remarkable way. They truly deserve some praise. . . Toyin Abraham Ikotun Moses Bliss Mercy Aigbe Davido Opay PiggyVest Champions League CarabaoCupFinal Good In Bed kotun",https://t.co/fVbfjdmY83,,en,142,33,4,1,20237,CarabaoCupFinal
1760399432556691486,853835628613689344,Wed Feb 21 20:21:46 +0000 2024,"omo, did PiggyVest null their Flex Dollar option couldnt convert my money back asap on App ",,,en,19,3,13,1,5284,
1759991713425182922,1577209003,Tue Feb 20 17:21:38 +0000 2024,"26th of May 2021 you used the safelock function on PiggyVest and locked N10 million 26,595 for 1000 days  35 You earned upfront N3.5m and for argument sake, spent it. Today, 1000 days later your N10m is worth 5,376.",,,en,166,58,6,27,44784,
1760023119350333905,1695424054814011394,Tue Feb 20 19:26:25 +0000 2024,This government will not see our end in this country  Moses Bliss Good In Bed CarabaoCupFinal Opay Naira Mercy Aigbe Toyin Abraham PiggyVest 1 CAD IPhone 16 Ikotun Davido David Adeleke,https://t.co/sfsG03GONE,,en,11,3,2,0,3735,CarabaoCupFinal
1760028101449482737,884510472,Tue Feb 20 19:46:13 +0000 2024,Imagine wetin' this woman go dey go sing by now . . Moses Bliss Good In Bed CarabaoCupFinal Opay Naira Mercy Aigbe Toyin Abraham PiggyVest Asake Ikotun Davido Mount Greenwood Ikotun,https://t.co/Z61snu9ODk,,en,21,12,3,0,8860,CarabaoCupFinal
1760000387333881911,1155186078904651778,Tue Feb 20 17:56:06 +0000 2024,A Man Was SmackDown By A Woman After He First Slapped Her. . . Tags. Pooja  Asake  Timper  USDT  Gistlover  PiggyVest,https://t.co/Ssv7BR3qIs,,en,4,0,4,0,4636,Gistlover
1760032152886853769,884510472,Tue Feb 20 20:02:19 +0000 2024,Is She trying to hide from the pain . . Moses Bliss Good In Bed CarabaoCupFinal Opay Naira Mercy Aigbe Toyin Abraham PiggyVest Asake Ikotun Davido Mount Greenwood Ikotun NigeriaProtest,https://t.co/wLPyWufFDO,,en,15,4,2,0,8835,CarabaoCupFinal NigeriaProtest
1760012646932193733,1155186078904651778,Tue Feb 20 18:44:49 +0000 2024,Which Kind Prank Be This Abeg  . . Tags. Asake  Dangote  Pooja  PiggyVest  USDT  iPhone 16,https://t.co/J5UqDN8wiz,,en,2,1,1,0,929,Dangote
1760018241769091511,884510472,Tue Feb 20 19:07:03 +0000 2024,There are lot of people that their fathers have money but they dont do it like Davido  Timaya . . Moses Bliss Good In Bed CarabaoCupFinal Opay Naira Mercy Aigbe Toyin Abraham PiggyVest 1 CAD IPhone 16 Ikotun Davido David Adeleke,https://t.co/oFI5LGh9LA,,en,17,3,0,0,6303,CarabaoCupFinal
1760010485523452020,1676876033419538434,Tue Feb 20 18:36:13 +0000 2024,Check out this beautiful Private Office interior and tell us what you think.  For more info DM   We Design amp Build   EFCC NigeriaProtest Tinubu Dear HR PiggyVest Moses Bliss Upwork Mr Banks,https://t.co/lfv0rU3cqt,,en,16,8,3,0,1954,EFCC NigeriaProtest
1760030904234422283,215043698,Tue Feb 20 19:57:22 +0000 2024,"The first guy na cheat, he is too smart . . Toyin Abraham Ikotun Moses Bliss Mercy Aigbe Davido Opay PiggyVest Champions League CarabaoCupFinal Good In Bed kotun",https://t.co/v4IvrmheSE,,en,7,1,2,0,3042,CarabaoCupFinal
1760006877780332910,1110053702801477632,Tue Feb 20 18:21:53 +0000 2024,"Our Kilishi PRICE LIST Beef kilishi  N2,000 Goat meat kilishi  N2,000 Chicken kilishi  N2,000 To place an order, please send a DM via our WhatsApp, Instagram or Twitter Handle or click link to our website. Aigbe Timber Mr Banks Moses Bliss Piggyvest Good In Bed Dear HR",https://t.co/ceuaPyB9of,,en,6,4,0,0,598,
1762186145968844822,1241839139210829824,Mon Feb 26 18:41:31 +0000 2024,Wait una still safelock money for PiggyVest as economy take be like this ,,,en,9,5,1,0,757,
1759941960809292147,873124590,Tue Feb 20 14:03:56 +0000 2024,When the garri is too much         Toyin Abraham .. Daniel Regha.. Davido .. Ice Prince .. Dangote .. Runtown .. Binance .. Lagos .. Emilokan .. PiggyVest .. 1USD .. Peter Obi .. Hunger .. iPhone 16,https://t.co/vZ55x0uUtV,,en,31,3,1,1,8446,
1759926425107243387,1054696069,Tue Feb 20 13:02:12 +0000 2024,"Brand New 3 Bedroom Mansionette with a Pool, available for sale at Lekki Phase 1, Lagos. Price 320m Gistlover Data Analytics Cardoso Chipper Return To Nigeria Tinubu Pastor Dapo Abiodun Makoko Dr Toolz PiggyVest Dangote Emilokan Ministry of Power Davido Eedris AEDC Hunger",https://t.co/wecAWpLCWj,,en,21,8,4,1,15000,Gistlover
1759584082957160765,4714760909,Mon Feb 19 14:21:51 +0000 2024,"A wild Lagos story, a game of FIFA and a big boy purchase Catch all the gist in this video with our Saver of the Month  , one of Nigerias finest photographers  PiggyvestSaveroftheMonth SOTM",https://t.co/ORo0CKmHeF,@tope_horpload,en,45,7,109,0,19993,PiggyvestSaveroftheMonth SOTM
1758420323551109180,562201602,Fri Feb 16 09:17:29 +0000 2024,Take 150k from your PiggyVest and ball this weekend. Stop thinking and start drinking,https://t.co/lROquYISpS,,en,1,2,1,0,1067,
1755350053286273463,219008570,Wed Feb 07 21:57:20 +0000 2024,The Artist must be hunted by spirits  Blood of Jesus  PiggyVest  My Bp Osimhen  South Africa  Man of the Match  Tyla  Desmond Elliot  Drag,https://t.co/SESUfoZROg,,en,15,7,2,0,6059,Osimhen
1755576448327324147,1375797507394011142,Thu Feb 08 12:56:56 +0000 2024,"I thought I was the only one using PiggyVest, Lowkey . . We Plenty ",https://t.co/3ekkOL9YSL,@PiggyBankNG,en,2,1,1,0,178,
1759981123961057706,4350691995,Tue Feb 20 16:39:33 +0000 2024,PiggyVest Dey trend ke ,https://t.co/APSk9R4O5F,,hu,36,11,4,2,6780,
1757205477274820634,857741244864352256,Tue Feb 13 00:50:07 +0000 2024,"Two days after I made this tweet, I started working with PiggyVest and grew the website's organic traffic by 185 in a little over three months. Yep, I basically created content that tripled the traffic of Nigeria's best savings and investment platform in record time. Crazy",,,en,588,70,27,5,62535,
1759585305164730509,1253267238074945536,Mon Feb 19 14:26:42 +0000 2024,"This is Piggyvest's billboard advert. Is it specific or not Bloody specific Save now so that you can break your KOLO by December. For them to use KOLO, it means they truly understand their readers' lingo. Oya go back  check Cowrywise. What's specific about the ad Nothing Confusing ad will attract confused readers. Y'all better unlearn rubbish.",,,en,43,5,11,3,8319,
1755744375512904058,1200156166246019072,Fri Feb 09 00:04:13 +0000 2024,Save your coins. New set of sneakers OTW. You go flex the flex naira in your PiggyVest Fine girl but why dont you want to buy my sneakers Abi you no like better thing ,https://t.co/bbus0nnmxE,,en,6,6,1,0,589,
1759513402932711788,1197038601139314688,Mon Feb 19 09:41:00 +0000 2024,Piggyvest give me money o. Ebi n pa mi ,https://t.co/P2PTc3WmC1,,tl,4,2,0,0,893,
1759876324229820530,2181911071,Tue Feb 20 09:43:07 +0000 2024,If you do mistake sell the dollar you saved on PiggyVest You might not get anyone to buy again cos theyve not had dollar to sell for like two weeks now,,,en,2,0,1,0,608,
1758839780312297930,853835628613689344,Sat Feb 17 13:04:15 +0000 2024,"Jimmy say make we go convert our Flex Naira to  at all at all, if e rise, we wont be left out PiggyVest say no dollar available ke e patewo ",https://t.co/tRJBDvJsdl,,en,2,1,6,1,4540,
1756272102607634750,465366864,Sat Feb 10 11:01:13 +0000 2024,Piggyvest no meet 15k inside my account today. That's what makes savings sweet. We go again tomorrow. No retreat no surrender,https://t.co/rNNNOSqBM6,,en,5,1,1,0,335,
1759588644426260787,1185328370894200832,Mon Feb 19 14:39:59 +0000 2024,"Yeah this is better than that cowrywise. But still don't understand why I have to search all over before seeing the piggyvest. What if I'm myopic What if I got colour blindness  Otherwise, this is better.",,,en,5,0,1,0,296,
1759958220926312490,769937066696335360,Tue Feb 20 15:08:32 +0000 2024,Just 2 weeks ago I bought USD for 1400 on PiggyVest. To convert it back to naira  the rate of 1765. Ilu yi su mi o,,,en,2,0,3,1,1012,
1756362075394212031,1662235666393059330,Sat Feb 10 16:58:45 +0000 2024,"On January 6th, I put 10k in my piggyvest as savings for rainy days. You guys wont believe it rained the same day ",,,en,77,58,17,0,3691,
1755574998033371595,921785295296716800,Thu Feb 08 12:51:11 +0000 2024,"Sometimes when I'm bored, I just open my PiggyVest app and stare at my money",,,en,106,28,16,9,7368,
1759898832630890854,260213811,Tue Feb 20 11:12:33 +0000 2024,Might actually withdraw my PiggyVest savings cos theres no point keeping money there anymore. It keeps losing value every passing day. Imagine saving to be poor,,,en,20,7,15,3,9408,
1755837766892441881,1253826074728960001,Fri Feb 09 06:15:20 +0000 2024,Its like theres piggyvest app update every 2 market days,,,en,7,0,3,1,720,
1753833226383077718,1245717914923270149,Sat Feb 03 17:30:00 +0000 2024,"The ongoing handson practical webflow mentorship 2.0. Yesterday's first session, We discussed how a website is different from a web app using piggyvest as a case study. Cos most times there is always this misinterpretation. Full video exclusive on youtube.",https://t.co/MuMoxBO1JY,,en,12,4,0,0,864,
1755340370982965285,1209738232260440064,Wed Feb 07 21:18:51 +0000 2024,PiggyVest pr team with this nwabali performance,https://t.co/b37fNkvDOp,,en,11,2,0,0,628,
1755345149993931230,1548298532167176193,Wed Feb 07 21:37:51 +0000 2024,Eagles Don Chop Banana Bafana. xenophobia AVLCHE Chukwueze Man of the Match South Africa From 20 to 11 Enyeama Osimhen Ourpiano Nwabali My BP PiggyVest DSTV Moffi Ola Aina Percy Tau Nwobi Nasty C,https://t.co/qYrKzT2W1y,,en,73,13,4,0,7082,xenophobia AVLCHE Osimhen Nwabali
1755346534135173448,884510472,Wed Feb 07 21:43:21 +0000 2024,Victor Osimhen and his injured teammate Victor Boniface . . Tyla Ourpiano Man of the Match DR Congo AVLCHE Blood of Jesus PiggyVest Roman Abramovich Haller xenophobia Gallagher and Chilwell Enzo and Caicedo,https://t.co/BLzIk6ThSI,,en,61,14,2,0,4187,AVLCHE xenophobia
1755331586155819460,1339304806922465280,Wed Feb 07 20:43:57 +0000 2024, Piggyvest is too fast,https://t.co/CVFEgWEZwa,,en,9,3,1,1,1082,
1755336529407348876,1489648275204583425,Wed Feb 07 21:03:35 +0000 2024,Piggyvest please nau...,https://t.co/YyhPvIsnZ6,,tl,54,7,0,0,1279,
1755332306628190686,1322672447578132480,Wed Feb 07 20:46:49 +0000 2024,Piggyvest sef dey cook South Africa. Haibo ,https://t.co/0f3lpf8oKd,,ht,11,5,0,0,459,
1755332387230093445,1182808982274105344,Wed Feb 07 20:47:08 +0000 2024,Wetin PiggyVest dey do,https://t.co/ZDCg3egeGo,,en,4,2,0,0,117,
1755332530125803729,1077915032992796677,Wed Feb 07 20:47:42 +0000 2024,Piggyvest nauu ,https://t.co/853cEohKoi,,tl,13,3,4,0,521,
1755331439149633960,385527909,Wed Feb 07 20:43:22 +0000 2024,PiggyVest dey give me joy,https://t.co/Wdm3Akka9H,,en,258,24,7,6,10996,
1755335792828776517,1051882719079215105,Wed Feb 07 21:00:40 +0000 2024,Piggyvest self dey chase banger ,https://t.co/U517neJITB,,en,39,2,1,1,4853,
1755185527198826965,1216856356172500993,Wed Feb 07 11:03:34 +0000 2024,"Celebrating the remarkable Odunayo Eweniyi  A trailblazer in Africa's tech scene, she's the cofounder and COO of Piggyvest, reshaping the fintech landscape and setting new standards of success. Here's to women leading the charge  AfricaAgility WomanCrushWednesday",https://t.co/QrLPAQKGzB,,en,43,1,0,0,1206,AfricaAgility WomanCrushWednesday
1755336753823580454,1355943843846357003,Wed Feb 07 21:04:29 +0000 2024,Piggyvest joor now,https://t.co/4R5BH2BFj2,,et,208,47,25,4,9467,
1755332330665681299,243231995,Wed Feb 07 20:46:54 +0000 2024,piggyvest calm down abeg,,,en,0,0,3,0,174,
1755333230637531159,424816596,Wed Feb 07 20:50:29 +0000 2024,Piggyvest theyll not mix salt with your sugar please ,https://t.co/5aBRnWcdzi,,en,161,21,3,1,11565,
1755331233154801951,1416516546,Wed Feb 07 20:42:33 +0000 2024,Piggyvest small small now,https://t.co/EpkgoTkI26,,en,5,4,0,1,3265,
1755336187860922729,1022207647095947265,Wed Feb 07 21:02:14 +0000 2024,Piggyvest joor now ,https://t.co/bdXtOWYGr3,,et,73,20,3,2,5840,
1755333163591614755,1067890167376224257,Wed Feb 07 20:50:13 +0000 2024,PiggyVest Abegggg,https://t.co/NSC4JDgPoc,,hu,75,11,1,2,6716,
1755336425703186483,2987517025,Wed Feb 07 21:03:11 +0000 2024,Every writer at PiggyVest deserves a monthly raise.,https://t.co/h4gqT7cTcM,,en,38,4,0,0,2748,
1755331367229911161,907351946734030849,Wed Feb 07 20:43:05 +0000 2024,Can I breathe PiggyVest,https://t.co/0UCqyyCoHY,,en,33,4,3,1,5054,
1750913544504123773,1870845991,Fri Jan 26 16:08:14 +0000 2024,Steal this marketing strategy from Piggyvests Pocket,https://t.co/Woe5yNR61p,,en,21,4,2,0,1868,
1752642071763063101,385527909,Wed Jan 31 10:36:47 +0000 2024,PiggyVest is pushing the boundaries with UX. I took a screenshot of this some days ago and I absolutely love that I dont have to go to AppStore to update the app as usual.,https://t.co/KTJbsjoGP3,,en,149,10,19,4,29828,
1752578865841533128,1735802274289537024,Wed Jan 31 06:25:37 +0000 2024,"Believe her when she says she doesnt have money Its her daily spending she doesnt have, theres money in her PiggyVest but its on safelock",,,en,76,72,9,0,1461,
1752334627384053875,1711745907144724480,Tue Jan 30 14:15:06 +0000 2024,"Piggyvest, But you can take a loan using your locked funds as collateral.",https://t.co/OZnNwkK38I,,en,9,2,0,1,739,
1751837739010457749,1097721358413373441,Mon Jan 29 05:20:39 +0000 2024,When you unlock your womans piggyvest.,,,en,314,93,8,1,21313,
1752643079482339587,1067890167376224257,Wed Jan 31 10:40:47 +0000 2024,Is it advisable to save in dollars on PiggyVest,,,en,32,4,25,3,9383,
1751939915900735672,366263790,Mon Jan 29 12:06:40 +0000 2024,Nobody knows how healing this can be. Withdraw from your piggyvest today.,,,en,3,2,1,0,292,
1753408752861032603,448312136,Fri Feb 02 13:23:18 +0000 2024,"I will go to war for pocket app, PiggyVest and Paystack, their customer service is not rubbish",,,en,179,65,22,12,27944,
1751944092978700429,344718204,Mon Jan 29 12:23:15 +0000 2024,You are not broke aha Send me screenshot of your piggyvest balance,,,en,1,0,1,0,179,
1752954414611009989,869642054,Thu Feb 01 07:17:55 +0000 2024,Na only Piggyvest de give person salary beginning of the month ,,,en,121,14,22,5,14103,
1753122742855962899,1579626557513076736,Thu Feb 01 18:26:47 +0000 2024,If lady opens her cowrywise or Piggyvest in your presence you'll know most of them are not broke,,,en,3,1,0,2,1305,
1753806140142473603,1389681029678522373,Sat Feb 03 15:42:22 +0000 2024,"PiggyVest and updates  Every two working days, theres an app update.",,,en,3,2,4,1,674,
1753175380205154692,308030665,Thu Feb 01 21:55:57 +0000 2024,"How one woman go dey save for Binance, Kuda, Cowrywise and Piggyvest at the same time.. Oluwaloseyi..Ogaju.",,,en,7,1,6,1,978,
1750805613292953744,991321041703243776,Fri Jan 26 08:59:21 +0000 2024,Can you save money in dollars using piggyvest Any interest attached,,@PiggyBankNG,en,3,2,2,0,833,
1751646357679399258,1298537925832040448,Sun Jan 28 16:40:10 +0000 2024,Open DM let me give you my Piggyvest Password,,,en,1,0,1,0,116,
1751922422364750220,1475857410233356298,Mon Jan 29 10:57:09 +0000 2024,My PiggyVest dey weep,,,en,11,2,3,0,1147,
1753039723054977089,771293241744433152,Thu Feb 01 12:56:54 +0000 2024,"Introducing the Piggyvest Customer Experience Center, Victoria Island, Lagos.",https://t.co/h7OPznWZOQ,,en,31,11,1,2,4875,
1753050369901392103,1334211220564488194,Thu Feb 01 13:39:12 +0000 2024,PiggyVest to Kuda,,,lt,0,0,0,0,183,
1753089721083863129,55787027,Thu Feb 01 16:15:34 +0000 2024,Why's Piggyvest telling me to update my app everytime I open it and there's no update on App Store,https://t.co/FbLFo17dVR,,en,0,0,0,0,195,
1750039162994954345,25912164,Wed Jan 24 06:13:45 +0000 2024,"Odun Eweniyi, cofounder and COO of Piggyvest, is not yet 30 and she is already a deeply inspiring figure. In this heartfelt conversation, we discuss feminism, Beyoncé, EndSARs, failing with 5 businesses, dealing with criticism, building a muchaloved brand  and the moment her dad died, and her life completely changed. We didnt get to say goodbye, she tells me. This subscribersonly exclusive is available right now on and WithChude MindHeartSpirit LetsBeHumanTogether  Have any issues with your subscription Please call 2348094321111. Also join our Telegram community on 2348094321111 for more exclusive content, personalised messages from me, and to watch interviews live",https://t.co/duT91ehfG6,,en,42,17,2,0,4383,EndSARs WithChude MindHeartSpirit LetsBeHumanTogether
1749431731545952717,1184839845207826432,Mon Jan 22 14:00:02 +0000 2024,PiggyVest Job Opportunities 7 Openings Qualification HND  Bachelor's Degree Location Lagos  Nigeria Deadline Not Specified APPLY,https://t.co/2kYl9JAugs,,en,8,3,0,0,1282,
1749535924394832148,1063589293057339392,Mon Jan 22 20:54:03 +0000 2024,"The husband to the woman that wanted killing her husband to take over her wealth, as VeryDarkman reacts to it . . . . TotalEnergiesAFCON2023 Ivory Coast Gistlover Naira Marley GNBNGA Mr ibu The Super Eagles Dear HR PiggyVest Cote D'Ivoire Sabinus NEPA Onyedika  peoplehelpingpeople Osimhen Round of 16 Odumodu Host Remi Tinubu",,,en,121,26,11,2,18121,TotalEnergiesAFCON2023 Gistlover GNBNGA peoplehelpingpeople
1749509958872277274,215043698,Mon Jan 22 19:10:53 +0000 2024,Ivory Coast fans left the stadium early before the game ended because their team was losing 40 to Equatorial Guinea. Kindly Follow us Super Eagles Drogba Naira Marley DJ Chicken Osimhen PiggyVest Portable Ivory Coast Ahmed Musa Nigeria,https://t.co/9LneRB2LAC,@Officialgboahtv,en,46,10,4,1,11895,
1749508990403277221,215043698,Mon Jan 22 19:07:02 +0000 2024,Own Goal Toh bad Kindly Follow us Super Eagles Drogba Naira Marley DJ Chicken Osimhen PiggyVest Portable Ivory Coast Ahmed Musa,https://t.co/gbJgw5q9gv,@officialgboahtv,en,4,0,0,0,2195,
1750196749002543363,1497849021095944199,Wed Jan 24 16:39:56 +0000 2024,piggyvest starts removing funds forcefully to save for you. lmaoo,https://t.co/GifNZ8idTU,,en,61,5,5,1,4084,
1817583637443068069,907351946734030849,Sun Jul 28 15:31:22 +0000 2024,Jesus Piggyvest breaking fee is now 3.5 Didnt know o,,,en,18,4,3,1,4402,
1817591230777163910,1242946903412744194,Sun Jul 28 16:01:33 +0000 2024,Piggyvest or Cowrywise I no too trust that gender,,@Charlexcasa3,en,0,0,0,0,25,
1817302898130165795,1519464958920118273,Sat Jul 27 20:55:49 +0000 2024,Shebi you see how piggyvest dey catch cruise and at the same time showing their relevance when it comes to savings Abi  Continue forming big boss Lori C.E.O wòrò sí wòrò Me to myself after seeing this tweet ,,,en,2,0,2,0,373,
1817655286364332504,926457277015576579,Sun Jul 28 20:16:05 +0000 2024,"at least you are saving, my piggyvest must think I am dead or something...",,,en,0,0,0,0,83,
1817544874679325091,1513507172134567936,Sun Jul 28 12:57:21 +0000 2024,"Whenever I feel low, I check my PiggyVest.",,,en,1,0,0,0,112,
1817636194320048206,873124590,Sun Jul 28 19:00:13 +0000 2024,Be like I'll go back to piggyvest,,,en,1,0,0,0,78,
1749864274481062114,1193950532047691780,Tue Jan 23 18:38:48 +0000 2024,Piggyvest is hiring for the following roles Internal Auditor Compliance Officer AML Analyst Information Security OfficerPocketApp Senior Product ManagerPocketApp Quality Assurance Engineer Treasury Executive Click the link below to apply,https://t.co/fc0EvCbRvO,,en,2,0,0,0,359,
1817644481732116983,1391686634257723392,Sun Jul 28 19:33:09 +0000 2024,i will empty my piggyvest,,,en,108,2,6,2,12840,
1748801171181949030,1477260125920370689,Sat Jan 20 20:14:25 +0000 2024,Piggyvest clear,,,en,0,0,0,0,120,
1817471545557803293,1186550888015581184,Sun Jul 28 08:05:58 +0000 2024,Since I downloaded this piggyvest I don't know how to go about it..I done register finish but de features in there de confuse me abeg who go show me way,,@PiggyBankNG,en,0,0,1,0,80,
1750123837457412508,1396911056740618242,Wed Jan 24 11:50:13 +0000 2024,I just check my PiggyVest app now 1one dollar is now 1425 That is almost 1500 It either you leverage on dollar or still broke,https://t.co/0vkdpRbMEQ,,en,3,0,2,0,487,
1750054173838602660,1498612549423714305,Wed Jan 24 07:13:24 +0000 2024,Women have money in piggyvest they wont touch,,,en,11,3,1,0,1261,
1745941706506219557,584889777,Fri Jan 12 22:51:55 +0000 2024,"But in Nigeria. Be patient, save in Piggyvest so that in 5 years you can afford a car from when George Bush was president.",,,en,2698,1329,46,51,226350,
1747306479659495853,1518881538913583104,Tue Jan 16 17:15:02 +0000 2024,There is a target Piggyvest 1m before end of Jan Bonkbot 30 sol before end of January Insha Allah,,,en,2,0,2,0,97,
1747786283072495767,1227870926768922624,Thu Jan 18 01:01:36 +0000 2024,"been a while diane, do u still use that same piggyvest account",,,en,1,0,2,0,289,
1747060158411206909,1463488645,Tue Jan 16 00:56:15 +0000 2024,This thread...everybody knows wassup with women...that money no fit come out of piggyvest lailai,,,en,0,0,0,0,132,
1748345658946343189,173525805,Fri Jan 19 14:04:22 +0000 2024,"Ive been using Piggyvest since 2018, I have NEVER had any type of issue whatsoever with getting my money when due, neither has anyone around me had any issue whatsoever. So this is false, very false",,,en,20,4,3,0,2309,
1745410925312508087,1186417529914306560,Thu Jan 11 11:42:47 +0000 2024,"My mates are downloading piggyvest to save money, Im downloading it to see if they have job listings on the app. God Abeg",,,en,4,3,2,0,497,
1745888685122318839,1492526101,Fri Jan 12 19:21:14 +0000 2024,I finally checked my grade on PiggyVest,https://t.co/pHx1BH23EO,,en,6,1,2,0,700,
1745813851180802511,1087350254817734656,Fri Jan 12 14:23:52 +0000 2024,"Buy me the wig, if you give me the money, Ill lock it in my PiggyVest ",,,en,5,2,4,0,1159,
1747519042791809352,1342820081894641665,Wed Jan 17 07:19:41 +0000 2024,Putting money there from PiggyVest gtgtgtgtgt,,,en,2,0,4,0,1214,
1747875484443029753,1171854955256393728,Thu Jan 18 06:56:04 +0000 2024,"If 10k enter now, 5k for fuel the remaining for shawarma and yoghurt. My pig for PiggyVest go slim this year",,,en,33,26,7,1,1316,
1748666858394309045,1441473186936213505,Sat Jan 20 11:20:42 +0000 2024,"If I withdraw another 100k from PiggyVest, they will lock me out and ban me from using their services.",,,en,2,0,0,0,339,
1747494347803656335,1433368445609988096,Wed Jan 17 05:41:34 +0000 2024,"I'm currently working on a piggyvest clone. I couldn't start earlier because of work but I managed to squeeze out time. The icons and fonts are all wrong, but do you see any similarities I'm using nextjs for this piggyvestclone piggyvest 100DaysOfCode reactjs nextjs",https://t.co/j6XHMFSRZF,,en,12,1,0,0,595,piggyvestclone piggyvest 100DaysOfCode reactjs nextjs
1748313996267037028,1250736722838781952,Fri Jan 19 11:58:33 +0000 2024,"I wonder why men dont believe their women whenever she says she is broke  Sincerely, she is broke oo, no piggyvest oo",,,en,23,8,7,0,1248,
1748284413962523031,1599111452656377858,Fri Jan 19 10:01:00 +0000 2024,"Many organizations do not take crisis management seriously enough. Regardless, crises can occur, and they often do so at the most inconvenient times. This case study of Flutterwave and PiggyVest's responses to crisis situations a few years ago is quite the contrast. Thread",,,en,26,20,1,1,2225,Thread
1748615465692185046,1027171500598743040,Sat Jan 20 07:56:29 +0000 2024,People that use piggyvest please is it only the add card method I can use to add money to the app,,,en,2,0,3,0,558,
